{
  "artifacts": [
    {
      "bytes": 531,
      "content_base64": "eyJlbmdpbmVfbmFtZSI6Im1jcGF1ZGl0IiwiZW5naW5lX3ZlcnNpb24iOiIyLjQuMCIsImV2aWRlbmNlIjp7InByb21wdF9jb3VudCI6MCwicmVzb3VyY2VfY291bnQiOjAsInNjaGVtYV9oYXNoX2FsZ29yaXRobSI6InNoYTI1NiIsInRvb2xfY291bnQiOjEsInRvb2xzIjpbeyJoYXNfYW5ub3RhdGlvbnMiOnRydWUsImhhc19pbnB1dF9zY2hlbWEiOnRydWUsImlucHV0X3NjaGVtYV9zaGEyNTYiOiJhMmM3OTkyNjJhM2NlM2MxOWVmNWNkZDk4M2JmM2QxMmI0M2FiM2M0MjYyMjcwOTFiOTA5ZGNiNzA1NDczOGMwIiwibmFtZSI6InN5bnRoZXRpYy10b29sIn1dfSwiZmluZGluZ3MiOltdLCJyaXNrIjp7ImFubm90YXRpb25fY292ZXJhZ2UiOjEuMCwiY29tcG9zaXRlIjowLjAsImRlc3RydWN0aXZlIjowLjAsImV4ZmlsdHJhdGlvbiI6MC4wLCJmaWxlX2FjY2VzcyI6MC4wLCJmaW5kaW5nc19ieV9zZXZlcml0eSI6e30sIm5ldHdvcmtfYWNjZXNzIjowLjAsInNoZWxsX2V4ZWN1dGlvbiI6MC4wfSwic2FuZGJveF9pbWFnZSI6bnVsbH0K",
      "encoding": "base64",
      "materialization_mode": "0600",
      "media_type": "application/json",
      "name": "engine-result.json",
      "sha256": "9f86ee405b08b1a4588bf7f5d87e8bf4e0e8785ddbc733d5e64ec2f8ad3bbef9"
    },
    {
      "bytes": 40960,
      "content_base64": "Li8AAAAAAAAAAAAAAAAAAAAAAAAAAAAAAAAAAAAAAAAAAAAAAAAAAAAAAAAAAAAAAAAAAAAAAAAAAAAAAAAAAAAAAAAAAAAAAAAAAAAAAAAAAAAAAAAAAAAAAAAAAAAAAAAAADAwMDA1MDAAMDAwMDAwMAAwMDAwMDAwADAwMDAwMDAwMDAwADAwMDAwMDAwMDAwADAwNjA2NgAgNQAAAAAAAAAAAAAAAAAAAAAAAAAAAAAAAAAAAAAAAAAAAAAAAAAAAAAAAAAAAAAAAAAAAAAAAAAAAAAAAAAAAAAAAAAAAAAAAAAAAAAAAAAAAAAAAAAAAAAAAAAAAAAAAAAAAAB1c3RhcgAwMAAAAAAAAAAAAAAAAAAAAAAAAAAAAAAAAAAAAAAAAAAAAAAAAAAAAAAAAAAAAAAAAAAAAAAAAAAAAAAAAAAAAAAAAAAAAAAAAAAAAAAAAAAAAAAAAAAAAAAAAAAAAAAAAAAAAAAAAAAAAAAAAAAAAAAAAAAAAAAAAAAAAAAAAAAAAAAAAAAAAAAAAAAAAAAAAAAAAAAAAAAAAAAAAAAAAAAAAAAAAAAAAAAAAAAAAAAAAAAAAAAAAAAAAAAAAAAAAAAAAAAAAAAAAAAAAAAAAAAAAAAAAAAAAAAAAAAAAAAAAAAAAAAAAAAAAAAAAAAAAAAAAAAAAABNQU5JRkVTVC5qc29uAAAAAAAAAAAAAAAAAAAAAAAAAAAAAAAAAAAAAAAAAAAAAAAAAAAAAAAAAAAAAAAAAAAAAAAAAAAAAAAAAAAAAAAAAAAAAAAAAAAAAAAAAAAAAAAAAAAAMDAwMDQwMAAwMDAwMDAwADAwMDAwMDAAMDAwMDAwMDI3NjQAMDAwMDAwMDAwMDAAMDEwMDQ1ACAwAAAAAAAAAAAAAAAAAAAAAAAAAAAAAAAAAAAAAAAAAAAAAAAAAAAAAAAAAAAAAAAAAAAAAAAAAAAAAAAAAAAAAAAAAAAAAAAAAAAAAAAAAAAAAAAAAAAAAAAAAAAAAAAAAAAAAHVzdGFyADAwAAAAAAAAAAAAAAAAAAAAAAAAAAAAAAAAAAAAAAAAAAAAAAAAAAAAAAAAAAAAAAAAAAAAAAAAAAAAAAAAAAAAAAAAAAAAAAAAAAAAAAAAAAAAAAAAAAAAAAAAAAAAAAAAAAAAAAAAAAAAAAAAAAAAAAAAAAAAAAAAAAAAAAAAAAAAAAAAAAAAAAAAAAAAAAAAAAAAAAAAAAAAAAAAAAAAAAAAAAAAAAAAAAAAAAAAAAAAAAAAAAAAAAAAAAAAAAAAAAAAAAAAAAAAAAAAAAAAAAAAAAAAAAAAAAAAAAAAAAAAAAAAAAAAAAAAAAAAAAAAAAAAAAAAAHsiYXJ0aWZhY3RzIjpbeyJieXRlcyI6NDY5LCJwYXRoIjoiY2F0YWxvZ19pZGVudGl0eS5qc29uIiwic2hhMjU2IjoiOGYyMWIyM2JlY2ViYjUxMjc5ZDBmNDVkZDQ3ODIzM2U1NzIyZmM1Y2Y3ZTA4ZmE4YzlkY2ZjYmI1ZWIxYjQxMCJ9LHsiYnl0ZXMiOjE5ODYsInBhdGgiOiJyZWNlaXB0cy9zeW50aGV0aWMtc2VydmVyLWFhYWFhYWFhYWFhYWFhYWFhYWFhYWFhYWFhYWFhYWFhLmpzb24iLCJzaGEyNTYiOiJmZTAxZmI4NzE0ZGJmMjNjZDFmY2VkNGNhNTlhMGZlOTk5OTY0MGNiZGRiZmRiMDgzMzhhOWM0NGY0NGI2MTE0In0seyJieXRlcyI6MjQ1NzYsInBhdGgiOiJyZWdpc3RyeS5kYiIsInNoYTI1NiI6ImMzZDNmNzllZGZmYWYxNjFhMjc5YWEyODgyMmY2MWE4OGRlNzYyZGY4MWViYThmMmMzZDJmNDBjNWJlOTU4YWIifSx7ImJ5dGVzIjo1NDEsInBhdGgiOiJzY2FuX3Jlc3VsdHMuanNvbiIsInNoYTI1NiI6IjUxZTIzNWQyOWYwMTQ1Mjc2NGUwMmFmYjgxMTQ0NzJkN2EzODExNzQyZjZlMzFlMGE1NmUxMDA0NThiNmY0ZGUifSx7ImJ5dGVzIjoxMTI2LCJwYXRoIjoic3RhdGljX3NuYXBzaG90Lmpzb24iLCJzaGEyNTYiOiI2YTZjMDViYWJlZGU0YmE1YjAzNTk2NzE0OWZiYWVjYjc0ZjVkM2Y2OGNiYzZiZDVmNDljMjI2NDA4Njg0NWI2In1dLCJhdXRob3JpdHkiOnsiY2FuZGlkYXRlX2NyZWF0aW9uIjp0cnVlLCJkZXBsb3ltZW50IjpmYWxzZSwicHVibGljYXRpb24iOmZhbHNlLCJzY2hlZHVsZV9jaGFuZ2UiOmZhbHNlfSwiY2FuZGlkYXRlX3N0YXRlIjoiZml4dHVyZSIsImNhdGFsb2ciOnsic2VlZF9zaGEyNTYiOiJkMzJmNTNhOGFiMjJjNjA0ZWFmZjUxYzk2YzJkODYzYzZlN2ZiNjY2YjQ5YzRlZmZjZjVlMmU1ZDljNzdiOWMwIiwic2VydmVyX2NvdW50IjoxfSwiY3JlYXRlZF9hdCI6IjIwMjYtMDctMzFUMDg6MDA6MDArMDA6MDAiLCJlbmdpbmVfdmVyc2lvbnMiOlsiMi40LjAiXSwiZXhwaXJlc19hdCI6IjIwMjYtMDgtMDFUMDg6MDA6MDArMDA6MDAiLCJtYXNraW5nIjp7InNoYTI1NiI6IjM3NTE3ZTVmM2RjNjY4MTlmNjFmNWE3YmI4YWNlMTkyMTI4MjQxNWYxMDU1MWQyZGVmYTVjM2ViMDk4NWI1NzAiLCJzbHVncyI6W119LCJwdWJsaWNhdGlvbl9hbGxvd2VkIjpmYWxzZSwic2FuZGJveCI6eyJtb2RlIjoiZGV0ZXJtaW5pc3RpYy1maXh0dXJlIiwicHJvZmlsZXMiOlt7ImNhcGFiaWxpdGllcyI6ImRyb3BwZWQtYWxsIiwiY3B1cyI6IjEiLCJpbWFnZSI6ImZpeHR1cmU6aW1hZ2UiLCJraW5kIjoiZG9ja2VyIiwibWVtb3J5IjoiNTEybSIsIm5ldHdvcmsiOiJub25lIiwibm9fbmV3X3ByaXZpbGVnZXMiOnRydWUsInBpZHNfbGltaXQiOjI1NiwicmVhZF9vbmx5X3Jvb3QiOnRydWUsInRtcGZzIjoiL3NjYW4iLCJ1c2VyIjoiMTAwMDoxMDAwIn1dfSwic2Nhbl9jb3VudHMiOnsiZmFpbGVkIjowLCJmcmVzaCI6MSwibWFza2VkIjowLCJ0b3RhbCI6MX0sInNjYW5fbW9kZSI6ImRldGVybWluaXN0aWMtZml4dHVyZSIsInNjaGVtYSI6IlJlZnJlc2hDYW5kaWRhdGVWMSJ9CgAAAAAAAAAAAAAAAE1BTklGRVNULnNoYTI1NgAAAAAAAAAAAAAAAAAAAAAAAAAAAAAAAAAAAAAAAAAAAAAAAAAAAAAAAAAAAAAAAAAAAAAAAAAAAAAAAAAAAAAAAAAAAAAAAAAAAAAAAAAAAAAAAAAwMDAwNDAwADAwMDAwMDAAMDAwMDAwMAAwMDAwMDAwMDEwMQAwMDAwMDAwMDAwMAAwMTAwNjMAIDAAAAAAAAAAAAAAAAAAAAAAAAAAAAAAAAAAAAAAAAAAAAAAAAAAAAAAAAAAAAAAAAAAAAAAAAAAAAAAAAAAAAAAAAAAAAAAAAAAAAAAAAAAAAAAAAAAAAAAAAAAAAAAAAAAAAAAdXN0YXIAMDAAAAAAAAAAAAAAAAAAAAAAAAAAAAAAAAAAAAAAAAAAAAAAAAAAAAAAAAAAAAAAAAAAAAAAAAAAAAAAAAAAAAAAAAAAAAAAAAAAAAAAAAAAAAAAAAAAAAAAAAAAAAAAAAAAAAAAAAAAAAAAAAAAAAAAAAAAAAAAAAAAAAAAAAAAAAAAAAAAAAAAAAAAAAAAAAAAAAAAAAAAAAAAAAAAAAAAAAAAAAAAAAAAAAAAAAAAAAAAAAAAAAAAAAAAAAAAAAAAAAAAAAAAAAAAAAAAAAAAAAAAAAAAAAAAAAAAAAAAAAAAAAAAAAAAAAAAAAAAAAAAAAAAAAAAMTQxNzRmZDQzZjIzOWQ5ZjQwNjQyODE0OTJjMzNhMDdkODVkMmQ5YjE3ZDRjYjI4N2Y5MTI2M2U4M2FkYzgxMgoAAAAAAAAAAAAAAAAAAAAAAAAAAAAAAAAAAAAAAAAAAAAAAAAAAAAAAAAAAAAAAAAAAAAAAAAAAAAAAAAAAAAAAAAAAAAAAAAAAAAAAAAAAAAAAAAAAAAAAAAAAAAAAAAAAAAAAAAAAAAAAAAAAAAAAAAAAAAAAAAAAAAAAAAAAAAAAAAAAAAAAAAAAAAAAAAAAAAAAAAAAAAAAAAAAAAAAAAAAAAAAAAAAAAAAAAAAAAAAAAAAAAAAAAAAAAAAAAAAAAAAAAAAAAAAAAAAAAAAAAAAAAAAAAAAAAAAAAAAAAAAAAAAAAAAAAAAAAAAAAAAAAAAAAAAAAAAAAAAAAAAAAAAAAAAAAAAAAAAAAAAAAAAAAAAAAAAAAAAAAAAAAAAAAAAAAAAAAAAAAAAAAAAAAAAAAAAAAAAAAAAAAAAAAAAAAAAAAAAAAAAAAAAAAAAAAAAAAAAAAAAAAAAAAAAAAAAAAAAAAAAAAAAAAAAAAAAAAAAAAAAAAAAAAAAAAAAAAAAAAAAAAAAAAAAAAAAAAAAAAAAAAAAAAAAAAAAAAAAAAAAAAAAAAAAAAAAAAAAAAAAAAAAAAAAAAAAABjYXRhbG9nX2lkZW50aXR5Lmpzb24AAAAAAAAAAAAAAAAAAAAAAAAAAAAAAAAAAAAAAAAAAAAAAAAAAAAAAAAAAAAAAAAAAAAAAAAAAAAAAAAAAAAAAAAAAAAAAAAAAAAAAAAAMDAwMDQwMAAwMDAwMDAwADAwMDAwMDAAMDAwMDAwMDA3MjUAMDAwMDAwMDAwMDAAMDEyMTU1ACAwAAAAAAAAAAAAAAAAAAAAAAAAAAAAAAAAAAAAAAAAAAAAAAAAAAAAAAAAAAAAAAAAAAAAAAAAAAAAAAAAAAAAAAAAAAAAAAAAAAAAAAAAAAAAAAAAAAAAAAAAAAAAAAAAAAAAAHVzdGFyADAwAAAAAAAAAAAAAAAAAAAAAAAAAAAAAAAAAAAAAAAAAAAAAAAAAAAAAAAAAAAAAAAAAAAAAAAAAAAAAAAAAAAAAAAAAAAAAAAAAAAAAAAAAAAAAAAAAAAAAAAAAAAAAAAAAAAAAAAAAAAAAAAAAAAAAAAAAAAAAAAAAAAAAAAAAAAAAAAAAAAAAAAAAAAAAAAAAAAAAAAAAAAAAAAAAAAAAAAAAAAAAAAAAAAAAAAAAAAAAAAAAAAAAAAAAAAAAAAAAAAAAAAAAAAAAAAAAAAAAAAAAAAAAAAAAAAAAAAAAAAAAAAAAAAAAAAAAAAAAAAAAAAAAAAAAHsic2NoZW1hIjoiUmVmcmVzaENhdGFsb2dJZGVudGl0eVYxIiwic2VlZF9zaGEyNTYiOiJkMzJmNTNhOGFiMjJjNjA0ZWFmZjUxYzk2YzJkODYzYzZlN2ZiNjY2YjQ5YzRlZmZjZjVlMmU1ZDljNzdiOWMwIiwic2VydmVyX2NvdW50IjoxLCJzZXJ2ZXJzIjpbeyJkZXNjcmlwdGlvbiI6IlJlc2VydmVkIGRldGVybWluaXN0aWMgZml4dHVyZSBzZXJ2ZXIiLCJob21lcGFnZSI6Imh0dHBzOi8vZXhhbXBsZS5pbnZhbGlkL3N5bnRoZXRpYy1zZXJ2ZXIiLCJuYW1lIjoiU3ludGhldGljIFNlcnZlciIsInNsdWciOiJzeW50aGV0aWMtc2VydmVyIiwic291cmNlIjp7ImFyZ3MiOltdLCJjb21tYW5kIjoiL3N5bnRoZXRpYy9iaW4vc2VydmVyIiwiZW52X2tleXMiOltdLCJraW5kIjoibnBtIiwicmVmZXJlbmNlIjoiQGV4YW1wbGUvc3ludGhldGljLXNlcnZlciIsInNhbmRib3hfaW1hZ2UiOm51bGwsInRydXN0ZWQiOmZhbHNlfX1dfQoAAAAAAAAAAAAAAAAAAAAAAAAAAAAAAAAAAAAAAAAAAAAAAAAAAAAAAAAAbWFza2VkLXByb29mcy8AAAAAAAAAAAAAAAAAAAAAAAAAAAAAAAAAAAAAAAAAAAAAAAAAAAAAAAAAAAAAAAAAAAAAAAAAAAAAAAAAAAAAAAAAAAAAAAAAAAAAAAAAAAAAAAAAADAwMDA1MDAAMDAwMDAwMAAwMDAwMDAwADAwMDAwMDAwMDAwADAwMDAwMDAwMDAwADAxMDUwMwAgNQAAAAAAAAAAAAAAAAAAAAAAAAAAAAAAAAAAAAAAAAAAAAAAAAAAAAAAAAAAAAAAAAAAAAAAAAAAAAAAAAAAAAAAAAAAAAAAAAAAAAAAAAAAAAAAAAAAAAAAAAAAAAAAAAAAAAB1c3RhcgAwMAAAAAAAAAAAAAAAAAAAAAAAAAAAAAAAAAAAAAAAAAAAAAAAAAAAAAAAAAAAAAAAAAAAAAAAAAAAAAAAAAAAAAAAAAAAAAAAAAAAAAAAAAAAAAAAAAAAAAAAAAAAAAAAAAAAAAAAAAAAAAAAAAAAAAAAAAAAAAAAAAAAAAAAAAAAAAAAAAAAAAAAAAAAAAAAAAAAAAAAAAAAAAAAAAAAAAAAAAAAAAAAAAAAAAAAAAAAAAAAAAAAAAAAAAAAAAAAAAAAAAAAAAAAAAAAAAAAAAAAAAAAAAAAAAAAAAAAAAAAAAAAAAAAAAAAAAAAAAAAAAAAAAAAAAByZWNlaXB0cy8AAAAAAAAAAAAAAAAAAAAAAAAAAAAAAAAAAAAAAAAAAAAAAAAAAAAAAAAAAAAAAAAAAAAAAAAAAAAAAAAAAAAAAAAAAAAAAAAAAAAAAAAAAAAAAAAAAAAAAAAAMDAwMDUwMAAwMDAwMDAwADAwMDAwMDAAMDAwMDAwMDAwMDAAMDAwMDAwMDAwMDAAMDA3NTQ3ACA1AAAAAAAAAAAAAAAAAAAAAAAAAAAAAAAAAAAAAAAAAAAAAAAAAAAAAAAAAAAAAAAAAAAAAAAAAAAAAAAAAAAAAAAAAAAAAAAAAAAAAAAAAAAAAAAAAAAAAAAAAAAAAAAAAAAAAHVzdGFyADAwAAAAAAAAAAAAAAAAAAAAAAAAAAAAAAAAAAAAAAAAAAAAAAAAAAAAAAAAAAAAAAAAAAAAAAAAAAAAAAAAAAAAAAAAAAAAAAAAAAAAAAAAAAAAAAAAAAAAAAAAAAAAAAAAAAAAAAAAAAAAAAAAAAAAAAAAAAAAAAAAAAAAAAAAAAAAAAAAAAAAAAAAAAAAAAAAAAAAAAAAAAAAAAAAAAAAAAAAAAAAAAAAAAAAAAAAAAAAAAAAAAAAAAAAAAAAAAAAAAAAAAAAAAAAAAAAAAAAAAAAAAAAAAAAAAAAAAAAAAAAAAAAAAAAAAAAAAAAAAAAAAAAAAAAAHJlY2VpcHRzL3N5bnRoZXRpYy1zZXJ2ZXItYWFhYWFhYWFhYWFhYWFhYWFhYWFhYWFhYWFhYWFhYWEuanNvbgAAAAAAAAAAAAAAAAAAAAAAAAAAAAAAAAAAAAAAAAAAAAAAAAAwMDAwNDAwADAwMDAwMDAAMDAwMDAwMAAwMDAwMDAwMzcwMgAwMDAwMDAwMDAwMAAwMjIxMDEAIDAAAAAAAAAAAAAAAAAAAAAAAAAAAAAAAAAAAAAAAAAAAAAAAAAAAAAAAAAAAAAAAAAAAAAAAAAAAAAAAAAAAAAAAAAAAAAAAAAAAAAAAAAAAAAAAAAAAAAAAAAAAAAAAAAAAAAAdXN0YXIAMDAAAAAAAAAAAAAAAAAAAAAAAAAAAAAAAAAAAAAAAAAAAAAAAAAAAAAAAAAAAAAAAAAAAAAAAAAAAAAAAAAAAAAAAAAAAAAAAAAAAAAAAAAAAAAAAAAAAAAAAAAAAAAAAAAAAAAAAAAAAAAAAAAAAAAAAAAAAAAAAAAAAAAAAAAAAAAAAAAAAAAAAAAAAAAAAAAAAAAAAAAAAAAAAAAAAAAAAAAAAAAAAAAAAAAAAAAAAAAAAAAAAAAAAAAAAAAAAAAAAAAAAAAAAAAAAAAAAAAAAAAAAAAAAAAAAAAAAAAAAAAAAAAAAAAAAAAAAAAAAAAAAAAAAAAAeyJhcHByb3ZhbCI6eyJhcHByb3ZhbF9yZWYiOm51bGx9LCJjYXZlYXRzIjpbIkF1dG9tYXRlZCBzY2FuIG91dHB1dCBpcyBub3QgYW4gZW5kb3JzZW1lbnQuIiwiRGFuZ2VyIGdyYWRlIGFuZCB0cmFuc3BhcmVuY3kgYXJlIHNlcGFyYXRlIHNpZ25hbHMuIiwiTG93IHRyYW5zcGFyZW5jeSBtZWFucyBjYW5ub3QgdmVyaWZ5IHNhZmUsIG5vdCBrbm93biBkYW5nZXJvdXMuIiwiTmV0d29yay1vZmYgc2FuZGJveGluZyBtYXkgc3VwcHJlc3MgYmVoYXZpb3IgdGhhdCByZXF1aXJlcyBsaXZlIGVncmVzcy4iXSwiZGFuZ2VyX3Njb3JlIjowLjAsImV2aWRlbmNlIjp7InByb21wdF9jb3VudCI6MCwicmVzb3VyY2VfY291bnQiOjAsInNjaGVtYV9oYXNoX2FsZ29yaXRobSI6InNoYTI1NiIsInRvb2xfY291bnQiOjEsInRvb2xzIjpbeyJoYXNfYW5ub3RhdGlvbnMiOnRydWUsImhhc19pbnB1dF9zY2hlbWEiOnRydWUsImlucHV0X3NjaGVtYV9zaGEyNTYiOiJhMmM3OTkyNjJhM2NlM2MxOWVmNWNkZDk4M2JmM2QxMmI0M2FiM2M0MjYyMjcwOTFiOTA5ZGNiNzA1NDczOGMwIiwibmFtZSI6In